name,description,campaign_type,status,message_text,message_type,media_path,caption,use_spintax,spintax_text,use_ab_testing,ab_variants,ab_split_percentages,start_time,end_time,timezone,messages_per_minute,messages_per_hour,messages_per_day,random_jitter_seconds,account_selection_strategy,account_weights,max_concurrent_accounts,recipient_source,recipient_list_id,recipient_filters,dry_run,respect_rate_limits,stop_on_error,max_retries,total_recipients,sent_count,failed_count,skipped_count,progress_percentage,start_time_actual,end_time_actual,last_activity,is_active,tags,notes
Welcome Campaign,Welcome new users to our platform,MASS_MESSAGE,DRAFT,Hello {name}! Welcome to our community. We're excited to have you here.,TEXT,,,,false,,false,,,2025-09-23 09:00:00,2025-09-23 18:00:00,UTC,5,50,500,10,ROUND_ROBIN,,3,MANUAL,,,false,true,true,3,100,0,0,0,0,,,,true,"welcome,onboarding,new_users","Campaign to welcome new users"
Product Launch,Announce new product launch,MASS_MESSAGE,SCHEDULED,🚀 Exciting news! We're launching {product_name} on {launch_date}. Get early access now!,TEXT,media/product_launch.jpg,Check out our new product!,true,🚀 {Exciting|Amazing|Incredible} news! We're launching {product_name} on {launch_date}. {Get early access now!|Don't miss out!|Be the first to try it!},true,"🚀 Exciting news! We're launching {product_name} on {launch_date}. Get early access now!;🎉 Amazing news! We're launching {product_name} on {launch_date}. Don't miss out!;⭐ Incredible news! We're launching {product_name} on {launch_date}. Be the first to try it!","40,35,25",2025-09-24 10:00:00,2025-09-24 16:00:00,UTC,3,30,300,15,WEIGHTED,"1,2,1,1,1",2,CSV,1,,false,true,true,5,500,0,0,0,0,,,,true,"product,launch,announcement","Product launch announcement campaign"
Follow-up Campaign,Follow up with existing users,MASS_MESSAGE,RUNNING,Hi {name}, I wanted to follow up on our conversation about {topic}. Do you have any questions?,TEXT,,,,true,Hi {name}, I {wanted|hope} to follow up on our conversation about {topic}. {Do you have any questions?|Let me know if you need anything!|Feel free to reach out!},false,,,2025-09-22 14:00:00,2025-09-22 20:00:00,UTC,2,20,200,5,ROUND_ROBIN,,1,MANUAL,,,false,true,false,3,50,25,2,0,50,2025-09-22 14:00:00,,2025-09-22 18:15:00,true,"followup,conversation,support","Follow-up campaign for existing users"
Event Invitation,Invite users to upcoming event,MASS_MESSAGE,PAUSED,You're invited to {event_name} on {event_date} at {event_location}. RSVP now!,TEXT,media/event_poster.jpg,Join us for this amazing event!,true,You're {invited|welcome} to {event_name} on {event_date} at {event_location}. {RSVP now!|Don't miss it!|Join us!},true,"You're invited to {event_name} on {event_date} at {event_location}. RSVP now!;You're welcome to {event_name} on {event_date} at {event_location}. Don't miss it!;You're invited to {event_name} on {event_date} at {event_location}. Join us!","45,35,20",2025-09-25 12:00:00,2025-09-25 18:00:00,UTC,1,10,100,20,WEIGHTED,"2,1,1,1,1",1,MANUAL,,,false,true,true,5,200,0,0,0,0,,,,true,"event,invitation,rsvp","Event invitation campaign"
Thank You Campaign,Thank users for their support,MASS_MESSAGE,COMPLETED,Thank you {name} for your {support|help|contribution}! We really appreciate it.,TEXT,,,,true,Thank you {name} for your {support|help|contribution}! We {really|truly|sincerely} appreciate it.,false,,,2025-09-20 09:00:00,2025-09-20 17:00:00,UTC,3,30,300,10,ROUND_ROBIN,,2,MANUAL,,,false,true,true,3,150,150,0,0,100,2025-09-20 09:00:00,2025-09-20 17:00:00,2025-09-20 16:45:00,true,"thanks,gratitude,appreciation","Thank you campaign for user support"
