Variable,Description
gipr_a,use guided imagery or progressive relaxation
giprpain_a,use guided imagery or progressive relaxation for pain
giprhlth_a,use guided imagery or progressive relaxation to restore overall health
yoga_a,practice yoga
yogabrth_a,breathing exercises as part of yoga
yogamed_a,meditation as part of yoga
yogapain_a,yoga for pain
yogahlth_a,yoga to restore overall health
vslvyr_a,voice problem in the past 12m
vslvdys_a,duration of voice problem
vslvdif_a,amount of difficulty with voice problem
vslswyr_a,swallowing problem in the past 12m
vslswdys_a,duration of swallowing problem
vslswdif_a,amount of difficulty with swallowing problem
vslspyr_a,speech problem in the past 12m
vslspdys_a,duration of speech problem
vslspdif_a,amount of difficulty with speech problem
vslspst_a,stuttering problem in the past 12m
vsllgyr_a,language problem in the past 12m
vsllgdys_a,duration of language problem
vsllgdif_a,amount of difficulty with language problem
vslbrain_a,vsl problems following a brain injury or stroke
vslpa_a,saw a doctor for treatment in the past 12m
vslpalf_a,seeing a doctor for treatment in the past 12m affected life
vslbtwr_a,vsl problem better or worse
orient_a,sexual orientation
marital_a,sample adult's current marital status
spousliv_a,sample adult's spouse lives here
spousep_a,sample adult's spouse does not reside here due to legal separation
evrmarried_a,sample adult has ever been married
marstat_a,current marital status of sample adult
legmstat_a,legal marital status of sample adult
spousesex_a,sex of sample adult's spouse
saspprace_a,race of sample adult and spouse or partner are the same
saspphisp_a,hispanic ethnicity of sample adult and spouse or partner are the same
spousagetc_a,"age of sample adult's spouse, top-coded"
spouseducp_a,education level of sample adult's spouse
spouswrk_a,working status of sample adult's spouse
spouswkft_a,sample adult's spouse is working full-time
prtnrsex_a,sex of the sample adult's partner
prtnragetc_a,"age of sample adult's partner, top-coded"
prtnreducp_a,education level of sample adult's partner
prtnrwrk_a,working status of sample adult's partner
prtnrwkft_a,sample adult's partner is working full-time
saparentsc_a,sample adult relationship to sample child
parstat_a,parental status of sample adult
afvet_a,ever serve active duty military
afvettrn_a,reserves or national guard
combat_a,ever served abroad during armed conflict
vadisb_a,have va disability rating
vahosp_a,receive care at va facility
vacareev_a,ever use va health care
natusborn_a,born in u.s. or u.s. territory
yrsinus_a,years that sample adult has been in the united states
citznstp_a,citizenship status
schcurenr_a,currently in school
schdymsstc_a,"days of school missed due to illness/injury past 12 months, top-coded"
emplastwk_a,worked for pay last week
empnowrk_a,temporarily absent from work last week
empwhynot_a,main reason not working
empwhenwrk_a,last time worked
empwrklsw1_a,worked last week
emplstwor1_a,last time worked for pay
empwkhrs3_a,hours worked per week (topcoded for public use)
empwrkft1_a,usually work 35+ hours per week
empsicklv_a,paid sick leave
emphealins_a,health insurance offered
empdysmss3_a,"days missed work, past 12 months (top-coded)"
cevolun1_a,volunteer for organization or association
cevolun2_a,other volunteer activities
pcntadtwkp_a,number of adults in sample adult's family who are working
pcntadtwfp_a,number of adults in sample adult's family who are working full-time
incwrko_a,income from wages
incinter_a,income from accounts
incssrr_a,income from ss/railroad retirement
incssissdi_a,family income from ssdi
ssissdibth_a,which family income ssi/ssdi
ssissdidsb_a,ssi/ssdi due to disability
incwelf_a,income from public assistance
incretire_a,income from retirement
incothr_a,income from other sources
impnum_a,imputation num
povrattc_a,sa family poverty ratio (top-coded)
ratcat_a,ratio of family income to poverty threshold for sa's family
impincflg_a,imputed sa family income imputation flag
inctcflg_a,sample adult family income top-code flag
fsnap12m_a,"receive food stamps, past 12m"
fsnap30d_a,"receive food stamps, past 30d"
fwic12m_a,"receive wic benefits, past 12m"
flunch12m_a,receive free/reduced meals at school
fdsrunout_a,worry food would run out
fdslast_a,food didn't last
fdsbalance_a,couldn't afford to eat balanced meals
fdsskip_a,cut the size of meals or skip meals
fdsskipdys_a,how many days did you/adults in the family cut the size of meals or skip meals
fdsless_a,eat less than should
fdshungry_a,ever hungry because not enough money for food
fdsweight_a,lose weight because not enough money for food
fdsnoteat_a,not eat for a whole day
fdsnedays_a,how many days not eat
fdscat3_a,adult 3 category food security recode
fdscat4_a,adult 4 category food security recode
houyrsliv_a,length of time in house/apartment
houtenure_a,residence owned/rented
hougvasst_a,paying lower rent
transpor_a,delay care in the past 12 months because no reliable transportation
cemmetng_a,attend public meeting
cevotelc_a,vote in last local elections
